{
  "$schema": "https://json-schema.org/draft/2020-12/schema",
  "$id": "https://borj.local/schemas/family-update.schema.json",
  "title": "Family update (ward -> family-gateway)",
  "description": "The ONLY shape of patient information that may leave the ward network. Pushed outbound by the family publisher to family-gateway (safety invariant 3) after the privacy filter and a nurse approval. This schema is an ALLOW-LIST: any field not listed is rejected (safety invariant 2). It must never carry vitals, NEWS2 or any score, drug names or doses, auto-generated reassurance, staff identities, locations or response times, or other patients' data. Free text exists only for nurse-written notes.",
  "type": "object",
  "required": ["schemaVersion", "updateId", "linkId", "kind", "publishedAt", "approval"],
  "properties": {
    "schemaVersion": { "$ref": "common.schema.json#/$defs/schemaVersion" },
    "updateId": { "$ref": "common.schema.json#/$defs/eventId" },
    "linkId": {
      "description": "Opaque family-link id bound to one admission. Not the admissionId, bed or patient label.",
      "$ref": "common.schema.json#/$defs/id"
    },
    "kind": {
      "description": "Allow-listed update types from the whitepaper (section 7.2).",
      "enum": ["visiting_info", "meal_served", "medication_round_completed", "nurse_note", "ward_contact"]
    },
    "text": {
      "description": "Nurse-written or nurse-approved template text. Required for nurse_note. Never generated by the system.",
      "type": "string",
      "minLength": 1,
      "maxLength": 280
    },
    "publishedAt": { "$ref": "common.schema.json#/$defs/utcTimestamp" },
    "approval": {
      "description": "Proof that a nurse approved this update. Deliberately carries no staff identity (staff protection).",
      "type": "object",
      "required": ["approved", "approvedAt"],
      "properties": {
        "approved": { "const": true },
        "approvedAt": { "$ref": "common.schema.json#/$defs/utcTimestamp" }
      },
      "additionalProperties": false
    }
  },
  "if": { "properties": { "kind": { "const": "nurse_note" } }, "required": ["kind"] },
  "then": { "required": ["text"] },
  "additionalProperties": false
}
