{
  "schemaVersion": 1,
  "updateId": "01K7ZQ8V3E4M5N6P7Q8R9S0T24",
  "linkId": "FL-7Q2M",
  "kind": "nurse_note",
  "text": "Your father had a quiet evening and ate most of his dinner. Visiting hours tomorrow are 13:00 to 15:00.",
  "publishedAt": "2026-10-10T20:05:00Z",
  "approval": { "approved": true, "approvedAt": "2026-10-10T20:04:30Z" }
}
